{
  "color": {
    "stone": {
      "0": "#FFFFFF",
      "50": "#FAFAF8",
      "100": "#F1F0EB",
      "200": "#E4E2DB",
      "300": "#D3D0C7",
      "400": "#B4AFA1",
      "500": "#8E887A",
      "600": "#66604E",
      "700": "#4B473E",
      "800": "#353128",
      "900": "#211E18",
      "950": "#16130F"
    },
    "orange": {
      "50": "#FFF1EA",
      "100": "#FFDFCE",
      "200": "#FFBE9C",
      "300": "#FF9462",
      "400": "#FB6E2E",
      "500": "#F4581C",
      "600": "#DD4A0F",
      "700": "#B23C0C",
      "800": "#882D09",
      "900": "#5C1E06"
    },
    "ocean": {
      "50": "#EAF1FB",
      "100": "#CFE0F4",
      "200": "#A6C6EA",
      "300": "#76A6DC",
      "400": "#4584CC",
      "500": "#2A68B5",
      "600": "#1F5BA6",
      "700": "#184780",
      "800": "#123356",
      "900": "#0C2238"
    },
    "teal": {
      "50": "#E7F7F6",
      "100": "#C5ECEA",
      "200": "#93DAD6",
      "300": "#63C7C1",
      "400": "#35B2AA",
      "500": "#1C9891",
      "600": "#167B76",
      "700": "#115F5C",
      "800": "#0D4744",
      "900": "#0A3533"
    },
    "amber": {
      "50": "#FBF3D6",
      "100": "#F6E3A6",
      "200": "#EDC85F",
      "300": "#DFAB1F",
      "400": "#C8930A",
      "500": "#A87A00",
      "600": "#876200",
      "700": "#694B00",
      "800": "#4B3500",
      "900": "#2F2100"
    },
    "red": {
      "50": "#FCE9ED",
      "100": "#F7C6CF",
      "200": "#EF98A8",
      "300": "#E4647C",
      "400": "#D43B57",
      "500": "#BE1F3D",
      "600": "#9C1631",
      "700": "#771025",
      "800": "#530B19",
      "900": "#330610"
    },
    "green": {
      "50": "#E8F6EF",
      "100": "#C7EAD9",
      "200": "#9EDCC0",
      "300": "#70CBA3",
      "400": "#48B988",
      "500": "#2EA070",
      "600": "#237F59",
      "700": "#1B6145",
      "800": "#134533",
      "900": "#0C2E22"
    },
    "purple": {
      "50": "#F4EFFA",
      "100": "#E5D7F4",
      "200": "#C9B0E6",
      "300": "#A988D6",
      "400": "#8961C2",
      "500": "#6F45A8",
      "600": "#5A3789",
      "700": "#432868",
      "800": "#2D1A48",
      "900": "#1A0F2C"
    },
    "pink": {
      "50": "#FBEEF3",
      "100": "#F5CDDC",
      "200": "#EA9CB7",
      "300": "#DD6F92",
      "400": "#CD4671",
      "500": "#B22F58",
      "600": "#8E2244",
      "700": "#6A1932",
      "800": "#461020",
      "900": "#29080F"
    }
  },
  "font": {
    "family": {
      "brand": "Lato",
      "text": "Lato",
      "mono": "JetBrains Mono"
    },
    "weight": {
      "regular": 400,
      "medium": 500,
      "semibold": 600,
      "bold": 700,
      "extrabold": 800
    },
    "size": {
      "2xs": 10,
      "xs": 12,
      "sm": 14,
      "md": 16,
      "lg": 18,
      "xl": 20,
      "2xl": 24,
      "3xl": 28,
      "4xl": 32,
      "5xl": 40,
      "6xl": 48
    },
    "lineHeight": {
      "2xs": 14,
      "xs": 16,
      "sm": 20,
      "md": 24,
      "lg": 28,
      "xl": 32,
      "2xl": 36,
      "3xl": 40,
      "4xl": 44,
      "5xl": 52,
      "6xl": 60
    },
    "letterSpacing": {
      "tight": -0.3,
      "normal": 0,
      "wide": 0.3
    }
  },
  "space": {
    "0": 0,
    "1": 2,
    "2": 4,
    "3": 6,
    "4": 8,
    "5": 12,
    "6": 16,
    "7": 20,
    "8": 24,
    "9": 32,
    "10": 40,
    "11": 48,
    "12": 64,
    "13": 80
  },
  "radius": {
    "xs": 2,
    "sm": 4,
    "md": 8,
    "lg": 12,
    "xl": 16,
    "2xl": 24,
    "round": 999
  },
  "border": {
    "width": {
      "thin": 1,
      "medium": 2,
      "thick": 3
    }
  },
  "opacity": {
    "muted": 0.7,
    "disabled": 0.5,
    "overlay": 0.6
  },
  "size": {
    "controlHeight": {
      "xs": 28,
      "sm": 32,
      "md": 40,
      "lg": 48,
      "calendarDay": 36
    },
    "icon": {
      "sm": 16,
      "md": 20,
      "lg": 24,
      "xl": 32
    }
  },
  "layout": {
    "container": {
      "sm": 640,
      "md": 960,
      "lg": 1200,
      "xl": 1440
    },
    "gutter": {
      "sm": 16,
      "md": 24,
      "lg": 32
    },
    "gridGap": {
      "sm": 16,
      "md": 24,
      "lg": 32
    },
    "navbar": {
      "height": 56
    }
  },
  "shadow": {
    "xs": "0 1px 2px rgba(28, 20, 10, 0.07)",
    "sm": "0 2px 6px rgba(28, 20, 10, 0.09)",
    "md": "0 8px 20px rgba(28, 20, 10, 0.11)",
    "lg": "0 16px 36px rgba(28, 20, 10, 0.13)",
    "xl": "0 24px 56px rgba(28, 20, 10, 0.17)"
  },
  "motion": {
    "duration": {
      "fast": 120,
      "normal": 200,
      "slow": 280,
      "xslow": 400
    },
    "easing": {
      "standard": "cubic-bezier(0.2, 0, 0, 1)",
      "decelerate": "cubic-bezier(0, 0, 0, 1)",
      "accelerate": "cubic-bezier(0.3, 0, 1, 1)"
    }
  },
  "zIndex": {
    "base": 0,
    "dropdown": 1000,
    "sticky": 1100,
    "overlay": 1200,
    "modal": 1300,
    "toast": 1400,
    "tooltip": 1500
  },
  "breakpoint": {
    "xs": 360,
    "sm": 600,
    "md": 900,
    "lg": 1200,
    "xl": 1536
  }
}
